{
  "id": "research-to-decision-workflow-01",
  "skill": "research-to-decision",
  "scenario": "We need to pick a message queue for order events between our checkout service and fulfillment service: Kafka or SQS. Research both and recommend one.",
  "fixture": "skills/research-to-decision/examples/kafka-vs-sqs-decision.md (contains the reference answer)",
  "reference_answer": "skills/research-to-decision/examples/kafka-vs-sqs-decision.md",
  "required_behaviors": [
    "defines evaluation criteria before scoring the options",
    "marks unverified/assumed claims explicitly rather than stating them as fact",
    "produces all three artifacts",
    "states what is given up by the chosen option, not just what is gained"
  ],
  "forbidden_behaviors": [
    "citing a specific external fact (benchmark number, pricing detail) with no source and no assumption flag"
  ],
  "expected_artifacts": [
    "RESEARCH.md",
    "DECISION_MATRIX.md",
    "ADR.md"
  ],
  "grading_notes": "Pass if the ADR names a concrete condition that would change the decision later."
}
