{
  "id": "production-code-review-workflow-01",
  "skill": "production-code-review",
  "scenario": "Review the attached diff before merge.",
  "fixture": "evaluations/fixtures/payments_endpoint.diff",
  "required_behaviors": [
    "flags the missing idempotency/concurrency protection as P0 or P1 with evidence pointing at the specific lines",
    "flags the absence of error handling around the Stripe call",
    "flags the absence of tests for this endpoint",
    "classifies each finding as FACT, LIKELY RISK, or OPTIONAL IMPROVEMENT",
    "ends with a merge recommendation consistent with the severities found (not safe to merge as-is)"
  ],
  "forbidden_behaviors": [
    "presenting a P3 style nitpick as blocking",
    "recommending 'safe to merge' while an unresolved P0/P1 stands"
  ],
  "expected_artifacts": ["findings list with severity/location/evidence/impact/fix", "merge recommendation"],
  "grading_notes": "Compare against skills/production-code-review/examples/idempotency-key-review.md, which reviews this same fixture."
}
